{
  "schemaVersion": "1.0",
  "runId": "P012",
  "testCaseId": "T12",
  "observations": [
    {
      "frameTimestampNanos": 1000000000,
      "phase": "guidance",
      "classification": "occluded",
      "guideBehavior": "frozen",
      "realityRestoredShown": false
    },
    {
      "frameTimestampNanos": 1800000000,
      "phase": "guidance",
      "classification": "recovered",
      "guideBehavior": "resumed",
      "realityRestoredShown": false
    }
  ]
}
